{
  "name": "NFT / Metaverse Project",
  "version": "1.0.0",
  "category": "nft",
  "description": "Hype-building videos for NFT collections, metaverse projects, and Web3 communities. FOMO-driven, visually striking, community-focused.",
  "icon": "🌐",
  "color": "#8B5CF6",

  "llm": {
    "system_prompt": "你是Web3/NFT项目的创意视频写手。你的脚本需要制造FOMO（错失恐惧）、展示稀缺性、建立社区认同感。\n\n核心公式：Vision-FOMO\n- Vision（愿景）：展示这个项目要改变什么，为什么现在是最佳时机\n- Scarcity（稀缺）：限量、限时、独家权益\n- Community（社区）：已经有多少人加入，社区的力量\n- Roadmap（路线图）：接下来会发生什么，持有者的未来收益\n- Mint/Join（行动）：明确的mint链接或加入方式\n\n规则：\n1. 前3秒必须是一个强烈的视觉陈述或问题\n2. 使用Web3社群的语言和meme（WAGMI、GM、LFG等适度用）\n3. 强调稀缺性和独家性\n4. 展示社区力量：\"已有X人加入\"\n5. 最后一段必须是紧迫的CTA\n6. 语气：自信、前卫、包容、有远见\n7. 回复英文，只返回脚本正文",
    "script_direction": "Vision-FOMO formula. 3 paragraphs. Start with bold statement. Emphasize scarcity + community. End with urgent mint CTA. Web3-native language.",
    "tone": "visionary_fomo",
    "max_paragraphs": 3,
    "language": "en"
  },

  "visual": {
    "style": "cyberpunk_neon_futuristic",
    "color_palette": ["#8B5CF6", "#06B6D4", "#F0ABFC", "#0F0F23"],
    "scene_types": ["3d_avatar_reveal", "roadmap_timeline", "community_mosaic", "utility_demo", "neon_title_card"],
    "aspect_ratio": "9:16",
    "energy": "high",
    "text_overlay": true
  },

  "voice": {
    "preset": "en-US-GuyNeural",
    "rate": 1.1,
    "volume": 1.0,
    "energy": "high",
    "description": "Confident, slightly aggressive. Builds excitement. Sounds like a community leader."
  },

  "bgm": {
    "mood": "electronic_futuristic",
    "tempo": "fast",
    "volume": 0.18,
    "description": "Synthwave or electronic beat. Drops when revealing artwork or mint details."
  },

  "keywords": {
    "seed": [
      "NFT collection launch",
      "digital art investment",
      "metaverse real estate",
      "Web3 community project",
      "crypto gaming token",
      "blockchain collectibles",
      "generative art drop",
      "virtual world experience"
    ],
    "negative": ["scam", "rug pull", "ponzi", "worthless", "crash"],
    "long_tail": [
      "best NFT projects to watch 2026",
      "how to find undervalued NFT collections",
      "metaverse land value prediction",
      "Web3 gaming tokens with utility"
    ]
  },

  "seo": {
    "title_templates": [
      "This {Adjective} NFT Collection Sold Out in {Timeframe} — Here's Why",
      "The {Year} {Chain} Ecosystem: {Number} Projects You Need to Watch",
      "I Analyzed {Number} NFT Projects. Only {Percent}% Have These {Number} Traits",
      "{CommunityName}: {Number} Holders. ${FloorPrice} Floor. One Collection.",
      "While Everyone Was {Distraction}, This Web3 Project Just {Achievement}"
    ],
    "description_templates": [
      "{vision_statement}\n\n⚡ Mint details:\n• Supply: {supply}\n• Price: {price}\n• Date: {date}\n\n{community_stats}\n\n{cta}",
      "The next blue chip is being minted right now.\n\n{project_differentiator}\n\nRoadmap highlights:\n• {milestone_1}\n• {milestone_2}\n• {milestone_3}\n\n{cta}"
    ],
    "funnel_keywords": {
      "awareness": [
        "what is NFT and how does it work",
        "best NFT marketplaces 2026",
        "how to buy digital art",
        "metaverse explained beginner"
      ],
      "consideration": [
        "best NFT collections to invest in",
        "how to spot undervalued NFT projects",
        "NFT rarity tool comparison",
        "which blockchain for NFT minting"
      ],
      "conversion": [
        "mint NFT now",
        "NFT allowlist spot",
        "limited edition NFT drop",
        "exclusive NFT presale access"
      ]
    },
    "content_type_keywords": {
      "video_script": ["NFT mint", "digital art reveal", "metaverse project", "Web3 community", "blockchain gaming"],
      "ad_copy": ["limited supply", "minting now", "allowlist open", "floor price moonshot", "blue chip potential"],
      "blog_post": ["NFT investment guide 2026", "how to evaluate NFT projects", "metaverse real estate buying guide", "Web3 gaming ecosystem overview", "digital art market analysis"],
      "social_post": ["NFT community", "gm frens", "WAGMI", "mint alert", "alpha leak", "floor price update"]
    },
    "platform_hashtags": {
      "twitter": ["#NFT", "#Web3", "#Crypto", "#NFTCommunity", "#Mint", "#DigitalArt", "#Metaverse", "#BlockchainGaming"],
      "instagram": ["#NFT", "#NFTArt", "#DigitalArt", "#CryptoArt", "#NFTCollector", "#Web3", "#Metaverse", "#NFTCommunity"],
      "tiktok": ["#NFT", "#Crypto", "#Web3", "#DigitalArt", "#NFTCommunity", "#Metaverse"],
      "discord": ["#NFT", "#Web3", "#Alpha", "#Mint", "#WAGMI"]
    }
  },

  "platforms": {
    "primary": ["twitter", "instagram"],
    "secondary": ["tiktok", "discord"],
    "optimal_time": "12:00-15:00 EST",
    "hashtag_strategy": "web3_trending_cross_chain"
  },

  "cta": {
    "primary": "⚡ MINTING NOW — Only 200 spots left. Link in bio.",
    "secondary": "Don't miss the next blue chip. Join the community 👇",
    "urgency": "high",
    "format": "mint_now"
  },

  "analytics_goals": {
    "target_ctr": 4.0,
    "target_conversion": 1.5,
    "target_retention": 55.0,
    "primary_metric": "mints"
  },

  "hook_examples": [
    "This NFT collection sold out in 47 seconds. Here's why...",
    "The metaverse isn't coming. It's already here. And you're early...",
    "2789 holders. $4.2M floor. One collection. This is what community looks like...",
    "While everyone was sleeping, this Web3 project just partnered with..."
  ]
}
